Full Name,Email,Ticket Type,Company Name,Personal Message
Danielle Richards,guest1@gmail.com,vip,Li and Sons,Leg beyond young focus pay own behind unit response feel.
David Williams,fernandezchristina@example.net,student,Daniels and Sons,Mission rate five write quickly whether election grow necessary require field.
Susan Bowman,andrew69@example.com,vip,Jimenez-Hahn,Series modern buy property industry attention provide movement appear rather recognize.
Alison Lester,janderson@example.com,silver pass,"""Whitehead","Brown and Powell"""
Deborah Williams,steelesara@example.com,standard,Hoover LLC,Door cut might heavy free.
Jacqueline Garcia,crussell@example.com,silver pass,Mayer Group,Thank challenge speak significant continue beyond great it rise.
Brian Heath,megananderson@example.org,gold pass,"""Garcia","Carter and Ford"""
Sarah Beard,cookemichael@example.org,silver pass,Guzman-Martin,Response couple defense financial president example part want character kid church listen respond.
William White,newtonwhitney@example.com,gold pass,Knight-Clark,Can enough you woman me care call writer whom easy.
Carlos Obrien,ethandorsey@example.net,gold pass,Mcmillan PLC,Service lose actually open laugh conference near government.
Monica Bowen,estradadebbie@example.org,gold pass,Stanley-Marks,Majority beat buy bring central his.
William Lopez,hernandezlisa@example.net,silver pass,Zamora-Moore,Election particular place picture seem child decision campaign coach that can travel anyone table.
Debra Flores,gonzalezlisa@example.net,vip,Anderson and Sons,Its stand parent specific form large future likely type speak bag tell upon such first executive career play firm.
Julie Oneill,cindyroman@example.org,student,Brennan Group,Meeting truth wrong which beyond perform use.
Jordan Hernandez,cynthia56@example.com,vip,Allen-Hill,Night what ball PM husband to future shake head be community organization.
Christine Thomas,jgonzalez@example.org,vip,Vasquez Inc,Lawyer whatever early surface maybe fire.
Pamela Smith,jennifer24@example.com,gold,,"Munoz and Bailey"""
Melanie Jones,larryfuller@example.org,student,Murphy-White,Mission cover according certainly all.
